{
  "schema_version": "xrai.eval.local.v2",
  "task_id": "D0-TJ-05",
  "family": "TSJS",
  "run_kind": "scripted_retrieval",
  "adapter": "selective-grep-v1",
  "model": null,
  "tokenizer": null,
  "usage": null,
  "financial_cost": null,
  "outcome": "not_judged",
  "setup_seconds": 0.004265916000008474,
  "permission_policy": "workspace_only_no_network",
  "environment": {
    "system": "Darwin",
    "release": "24.6.0",
    "machine": "arm64",
    "python": "3.13.13",
    "executor_sha256": "effbbd938667d7431629a73b2d4caeb9becebca7af2ec94d5a437250feafd143",
    "containment_sources_sha256": {
      "adapters.py": "90218bd545a99dee1a4530a2b1155f69b0ece2e3dcaf8fbd07fd89c88b8041e4",
      "supervisor.py": "8fb13b93a1c3ebdd7a1cf7ab2d1c5f75e8beccf335ad53c064165d95a85d1571"
    }
  },
  "input_sha256": "e2da73fb2f1f8ac9efd275562434220f6ba8d345642d5a70667c4ed63541c5cf",
  "rounds": [
    {
      "phase": "inventory",
      "command": [
        "/usr/bin/find",
        ".",
        "-type",
        "f"
      ],
      "status": "ok",
      "execution_status": "ok",
      "exit_code": 0,
      "sandbox": "macOS Seatbelt",
      "containment": "macos_local_known_smoke",
      "cleanup_status": "not_proven",
      "domain_id": "4a21ea34-4ca9-4b8c-b0e2-d40dd75b38ce",
      "termination_evidence": {
        "wrapper_reaped": true,
        "scope": "process_group_only_no_daemon_guarantee"
      },
      "eligible_for_agent_run": false,
      "diagnostic": null,
      "elapsed_seconds": 0.013225292000015543,
      "stdout": {
        "base64": "Li9saWNlbnNlLm1kCi4vaW5kZXguanMKLi8ubnBtcmMKLi9yZWFkbWUubWQKLi90ZXN0cy5qcwouLy5naXRpZ25vcmUKLi9wYWNrYWdlLWxvY2suanNvbgouL3BhY2thZ2UuanNvbgouLy5naXRodWIvd29ya2Zsb3dzL2NpLnltbAo=",
        "sha256": "29dbce712b011d43eba8c9779306c78b0ba6434f2556942a48fcbaea56668455",
        "captured_bytes": 131,
        "observed_bytes": 131,
        "truncated": false
      },
      "stderr": {
        "base64": "",
        "sha256": "e3b0c44298fc1c149afbf4c8996fb92427ae41e4649b934ca495991b7852b855",
        "captured_bytes": 0,
        "observed_bytes": 0,
        "truncated": false
      }
    },
    {
      "phase": "selective_reading",
      "command": [
        "/usr/bin/grep",
        "-R",
        "-n",
        "-I",
        "-i",
        "-m",
        "3",
        "-C",
        "3",
        "-E",
        "--include=*.rs",
        "--include=*.ts",
        "--include=*.tsx",
        "--include=*.js",
        "--include=*.jsx",
        "--include=*.py",
        "--include=*.go",
        "--exclude-dir=.git",
        "Identifique|limite|tamanho|input|parser|resultado|texto|maior|100|caracteres",
        "."
      ],
      "status": "ok",
      "execution_status": "ok",
      "exit_code": 0,
      "sandbox": "macOS Seatbelt",
      "containment": "macos_local_known_smoke",
      "cleanup_status": "not_proven",
      "domain_id": "9b38e3c6-f2fc-4828-abde-ac07ac7d0884",
      "termination_evidence": {
        "wrapper_reaped": true,
        "scope": "process_group_only_no_daemon_guarantee"
      },
      "eligible_for_agent_run": false,
      "diagnostic": null,
      "elapsed_seconds": 0.04147550000001843,
      "stdout": {
        "base64": "Li9pbmRleC5qcy0yLSAqIEhlbHBlcnMuCi4vaW5kZXguanMtMy0gKi8KLi9pbmRleC5qcy00LQouL2luZGV4LmpzOjU6dmFyIHMgPSAxMDAwOwouL2luZGV4LmpzLTYtdmFyIG0gPSBzICogNjA7Ci4vaW5kZXguanMtNy12YXIgaCA9IG0gKiA2MDsKLi9pbmRleC5qcy04LXZhciBkID0gaCAqIDI0OwotLQouL2luZGV4LmpzLTQ3LQouL2luZGV4LmpzLTQ4LWZ1bmN0aW9uIHBhcnNlKHN0cikgewouL2luZGV4LmpzLTQ5LSAgc3RyID0gU3RyaW5nKHN0cik7Ci4vaW5kZXguanM6NTA6ICBpZiAoc3RyLmxlbmd0aCA+IDEwMCkgewouL2luZGV4LmpzLTUxLSAgICByZXR1cm47Ci4vaW5kZXguanMtNTItICB9Ci4vaW5kZXguanMtNTMtICB2YXIgbWF0Y2ggPSAvXigtPyg/OlxkKyk/XC4/XGQrKSAqKG1pbGxpc2Vjb25kcz98bXNlY3M/fG1zfHNlY29uZHM/fHNlY3M/fHN8bWludXRlcz98bWlucz98bXxob3Vycz98aHJzP3xofGRheXM/fGR8d2Vla3M/fHd8eWVhcnM/fHlycz98eSk/JC9pLmV4ZWMoCi0tCi4vdGVzdHMuanMtMTgtICB9KTsKLi90ZXN0cy5qcy0xOS0KLi90ZXN0cy5qcy0yMC0gIGl0KCdzaG91bGQgcHJlc2VydmUgbXMnLCBmdW5jdGlvbigpIHsKLi90ZXN0cy5qczoyMTogICAgZXhwZWN0KG1zKCcxMDAnKSkudG8uYmUoMTAwKTsKLi90ZXN0cy5qcy0yMi0gIH0pOwouL3Rlc3RzLmpzLTIzLQouL3Rlc3RzLmpzLTI0LSAgaXQoJ3Nob3VsZCBjb252ZXJ0IGZyb20gbSB0byBtcycsIGZ1bmN0aW9uKCkgewotLQouL3Rlc3RzLmpzLTM4LSAgfSk7Ci4vdGVzdHMuanMtMzktCi4vdGVzdHMuanMtNDAtICBpdCgnc2hvdWxkIGNvbnZlcnQgcyB0byBtcycsIGZ1bmN0aW9uKCkgewouL3Rlc3RzLmpzOjQxOiAgICBleHBlY3QobXMoJzFzJykpLnRvLmJlKDEwMDApOwouL3Rlc3RzLmpzLTQyLSAgfSk7Ci4vdGVzdHMuanMtNDMtCi4vdGVzdHMuanMtNDQtICBpdCgnc2hvdWxkIGNvbnZlcnQgbXMgdG8gbXMnLCBmdW5jdGlvbigpIHsKLi90ZXN0cy5qczo0NTogICAgZXhwZWN0KG1zKCcxMDBtcycpKS50by5iZSgxMDApOwouL3Rlc3RzLmpzLTQ2LSAgfSk7Ci4vdGVzdHMuanMtNDctCi4vdGVzdHMuanMtNDgtICBpdCgnc2hvdWxkIHdvcmsgd2l0aCBkZWNpbWFscycsIGZ1bmN0aW9uKCkgewo=",
        "sha256": "86e86674fd740c075079980c1370bcaaffdfb280f457ab4ebe37600b40985532",
        "captured_bytes": 1130,
        "observed_bytes": 1130,
        "truncated": false
      },
      "stderr": {
        "base64": "",
        "sha256": "e3b0c44298fc1c149afbf4c8996fb92427ae41e4649b934ca495991b7852b855",
        "captured_bytes": 0,
        "observed_bytes": 0,
        "truncated": false
      }
    }
  ],
  "measurement": {
    "captured_bytes": 1261,
    "model_tokens": null
  },
  "limitations": [
    "scripted retrieval; no agent success or competitive advantage measured",
    "no model tokenizer configured; token counts and model costs unknown"
  ],
  "transcript_sha256": "ef69f5db7324031cdddf966d2ccd3f929dc9fe22a0fe347543d280b49acc7fdc",
  "workspace_sha256": "f240f53e2fce629b8e97fb21a38647f61c3861eb9c1cf602be23462c6613c07f"
}
